ID,Title,AutomationStatus,
76518,E2E: Verify that user is able to save the values selected for drop down along with the inputs for other controls to the local Database on Save (default and selectable values),Planned,
76519,E2E: Verify that for an App on the list view the user should be able to see correct value of dropdown for a record on the list view,Planned,
76604,Verify the App behaviour when user deletes value from all the field son edit page and clicks on save,Not Automated,
76605,Verify the App behavior when the user does not change any value on the edit page and clicks on Save,Not Automated,
76606,Verify the App behavior when user tries to add value to field on edit page which was left black at the time of record creation,Not Automated,
76739,Verify that the ID property for the Label control is Read-only(non-editable).,Not Automated,
76740,Verify that the ID property for the label control should always be unique.,Planned,
76741,Verify that it is mandatory for an app developer to provide a Display text in the label control.,Planned,
76742,Verify that an error message is displayed below Font color property if app dev passes any wrong HEX color.,Planned,
76743,Verify that app dev can pass alphanumeric value as Display Text inside Label control.,Planned,
76744,Verify that App dev can pass any special character as Display text inside Label control.,Planned,
76745,Verify that there is no validation present in the Font Style property on the Label control.,Planned,
76746,Verify that there is no validation present in the Alignment property on the Label control.,Planned,
76747,Verify that app dev can only pass a value between 1-99 as Font size inside Label control.,Planned,
76748,Verify that an error message is displayed below Margin property if app dev passes any invalid entry in Right Margin Property.,Not Automated,
76749,Verify that an error message is displayed below Margin property if app dev passes any invalid entry in Left Margin Property.,Not Automated,
76750,Verify that an error message is displayed below Margin property if app dev passes any invalid entry in Top Margin Property.,Not Automated,
76751,Verify that an error message is displayed below Margin property if app dev passes any invalid entry in Bottom Margin Property.,Not Automated,
76752,Verify that app dev can only enter max of 200 characters in the input field of the Display text  property.,Planned,
77226,Verify that user is able to edit and then save a prefilled form by tapping on any entry on the list view of an app containing Dropdown control.,Not Automated,
77227,Verify that the updated record is visible in the list view having an app of textbox and check boxes only.,Not Automated,
77228,Verify that when user tap on any existing recode in the list view then value of control (drop down and other controls) for that record should be visible on the device.,Not Automated,
77229,Verify that once updated the records get saved in the SQLite DB.,Not Automated,
77230,Verify that the values of the flag "Updated On" inside SQLite DB should lock the new value each time the record is updated.,Not Automated,
77231,Verify the App behavior when the user does not change any value of Drop down on the edit page and clicks on Save.,Not Automated,
77232,Verify that user is allowed to submit a blank record when tries to edit a form containing a combination of dropdown; textbox and check boxes.,Not Automated,
77246,E2E: Verify that if the user does not set any default option for dropdown on console by default 'select a value' is option is displayed first in the list at agent,Planned,
77247,E2E: Verify that if user does not select any value on dropdown at agent when no default value is set on console 'Select a value' is save on the SQLite DB,Planned,
77248,E2E: Verify that all values of dropdown should be displyed in a the same order as set on Server.,Planned,
77249,Verify that user has a provision of displaying 'Select a value' in absence of any default value configured on console.,Not Automated,
77281,Verify that for a dropdown control app user is allowed to udpate any existing record available in the list view.,Not Automated,
77282,Verify that the updated record is visible in the list view having an app with a combination of textbox dropdown and check boxes.,Not Automated,
77283,Verify that when user tap on any existing records in the list view then value of the dropdown control for that record should be visible on the form page in Edit mode.,Not Automated,
77284,Verify that the updated data regarding dropdown controls are getting reflected on the SQLite DB of the device agent,Not Automated,
77285,Verify that user is allowed to update a record mulitple times in an app having dropdown; textbox and checkboxes.,Not Automated,
77286,Verify that the data only gets updated and reflected on the list view and inside SQLite DB if user taps on Submit/ Save button.,Not Automated,
77287,Verify that the values of "Updated On" field gets updated each time when user taps on Save/Submit button on the web form.,Not Automated,
77288,Verify the App behavior when the user does not change any value on the edit page and clicks on Save/ Submit.,Not Automated,
77290,Verify that an app user is allowed to update a blank value of a dropdown control.,Not Automated,
77335,Verify that when user lands on IDE page he gets default form and blank page by default,Not Automated,
77336,Verify that user has a option to add multiple pages under the form,Not Automated,
77337,Verify that user should not be able to add form.,Not Automated,
77338,Verify that user can rename the default form and blank page,Not Automated,
77339,Verify that user can rename any page added to the form,Not Automated,
77340,Verify the properties of Add new page overlay,Not Automated,
77341,Verify that user can connect multiple pages using buttons setting the click event to navigate on different page,Not Automated,
77342,Verify that submit button should be common to the form irrespective of its placement page,Not Automated,
77343,Verify that user can drop all in scope control to all pages of a multipage App and set their properties,Not Automated,
77344,Verify that properties of all Label controls are maintained and not get reset when user moves across the pages in a multi- page Appand when formatting changes are applied.,Not Automated,
77345,Verify that properties of all Text controls are maintained and not get reset when user moves across the pages in a multi- page App.,Not Automated,
77346,Verify that properties of all Check box controls are maintained and not get reset when user moves across the pages in a multi- page App.,Not Automated,
77347,Verify that properties of all button controls are maintained and not get reset when user moves across the pages in a multi- page App.,Not Automated,
77348,Verify that properties of all Camera controls are maintained and not get reset when user moves across the pages in a multi- page App.,Not Automated,
77349,Verify that properties of all List view Controls are maintained and not get reset when user moves across the pages in a multi- page App.,Not Automated,
77350,Verify that properties of all dropdown controls are maintained and not get reset when user moves across the pages in a multi- page App.,Not Automated,
77351,Verify that user is not allowed to publish an App without alteast one control,Not Automated,
77352,Verify that user is able create a splash page in combination of App form,Not Automated,
77353,Verify that save action saves all the controls and pages of the App to the database (check JSON),Not Automated,
77354,Verify that publish action publishes the multipage app status changes to Active and App table schema is generated in database using,Not Automated,
77355,Verify that only one schema is generated per form irrespective of no. of pages,Not Automated,
77356,Verify that user is able to Block a multipage App and reflect the same on agent,Not Automated,
77357,Verify that user is able to Delete a multipage App and reflect the same on agent,Not Automated,
77358,Verify that user is able to create and publish a multipage app using all in scope module i.e. Splash screen List view and all controls.,Not Automated,
77359,Verify that Multipage App is rendered successfully on Agent as created on console,Not Automated,
77360,Verify that sequence of forward navigation is maintained between the pages at Agent side as set on Console,Not Automated,
77361,Verify that sequence of backward navigation is maintained between the pages at Agent side as set on Console,Not Automated,
77362,Verify that All controls in scope are rendered successfully on all the pages on the App on Agent as configured on Console.,Not Automated,
77363,Verify that user is able to insert values in all input controls of a multipage app and sync them back to server,Not Automated,
78207,Verify the properties of all the controls should be expanded by default,Not Automated,
78208,Verify that the 'Margin' property should be displayed as the last property in all the controls,Not Automated,
78372,Verify that Edit icon for a form is clickable and makes the Form name editable,Not Automated,
78373,Verify that user can provide new name to form and save it using save icon or enter button,Not Automated,
78374,Verify that while editing form name before saving if focus is lost due to escape key the changes are lost and previous value is populated (default and any name),Not Automated,
78375,Verify that while  editing form name before saving if focus is lost due to tab out or mouse movement  the changes are lost and previous value is populated (default and any name),Not Automated,
78376,Verify the field length ( Min 2- Max 50 )  validations for form name,Not Automated,
78377,Verify that if user clears the form name and click save  the last saved value should be taken as form name.,Not Automated,
78378,Verify that updated form name is taken into JSOn whenever an App is saved.,Not Automated,
78379,Verify that Edit icon for a Page is clickable and makes the Page name editable,Not Automated,
78380,Verify that user can provide new name to Page and Fomr save it using save icon or enter button,Not Automated,
78381,Verify that while editing page name before saving if focus is lost due to escape key the changes are lost and previous value is populated (default and any name),Not Automated,
78382,Verify that while editing page name before saving if focus is lost due to tab out or mouse movement  the changes are lost and previous value is populated (default and any name),Not Automated,
78383,Verify the field length ( Min 2- Max 50 )  validations for Page name,Not Automated,
78384,Verify that if user clears the Page name and click save  the last saved value should be taken as Page name.,Not Automated,
78385,Verify that if user renames the Page  it should be reflected on List view control properties and Error list,Not Automated,
78386,Verify that updated Page name is taken into JSOn whenever an App is saved.,Not Automated,
78387,Verify that the delete icon next to page should be clickable,Not Automated,
78388,Verify that elements of Delete page confirmation overlay.,Not Automated,
78389,Verify that after deletion the focus of App should be taken to first page of the App,Not Automated,
78390,Verify that deleted page is removed from JSON whenever an App is saved.,Not Automated,
78391,Verify that if form has only one page it cannot be deleted and the delete icon should be removed.,Not Automated,
78440,Verify the checkbox option is available on the IDE,Planned,
78441,Verify the user is able to drag the checkbox option and drop it on the canvas on any page.,Planned,
78442,Verify all the properties of checkbox are expanded by default and user can collapse and expand it again.,Planned,
78443,Verify the ID in the checkbox property should be editable.,Planned,
78444,Verify the default value of 'Descriptive name ' and is editable.,Planned,
78445,Verify the 'Descriptive name ' property should be editable,Planned,
78446,Verify an error should display if the 'Descriptive name ' is empty,Planned,
78447,Verify the BVA of 'Descriptive name ' property and should accept values having alphabets numeric and special characters,Planned,
78448,Verify the 'Descriptive name ' should accept values having alphabets numeric and special characters,Planned,
78450,Verify the data source property of checkbox,Planned,
78451,Verify the default value of Label and ID under data source and these textboxes should be editable,Planned,
78452,Verify the Label and ID textboxes underdata source are editable,Planned,
78453,Verify the error message if the Label textbox under data source is empty,Planned,
78454,Verify the BVA of Label textbox property and can be input wit alphabets numeric and special characters,Planned,
78455,Verify the Label textbox can be input wit alphabets numeric and special characters,Planned,
78456,Verify the error message if the ID textbox under data source is empty,Planned,
78457,Verify the BVA of ID textbox property,Planned,
78458,Verify the ID textbox of checkbox can be input with alphabets numeric and special characters,Planned,
78459,Verify the default value of ID textbox under data source is unique everytime a data source is added,Not Automated,
78460,Verify the user can add more data source options using the Add option button and  the datasources should be displayed under data source,Planned,
78461,Verify all the data source option are displayed under data source,Planned,
78462,Verify the user can delete any option of data source,Planned,
78463,Verify the user should not be able to delete the last data source as the delete button should be hidden.,Planned,
78464,Verify all the options added should get display on the canvas displaying the text value and should be in the same order as in properties,Planned,
78465,Verify all the options added in the data source should be display in select default dropdown,Not Automated,
78466,Verify the default value of select default dropdown.,Not Automated,
78467,Verify the default value of radio button can be selected through select default dropdown and changes should be reflected on the canvas,Not Automated,
78468,Verify the order of the options of data source,Planned,
78469,Verify the default value of 'Left Margin',Not Automated,
78470,To verify that Left Margin property is editable,Not Automated,
78471,To verify the changes made in the left margin should be reflected on the canvas,Not Automated,
78472,Verify the default value of 'Right Margin',Not Automated,
78473,To verify that Right Margin property is editable,Not Automated,
78474,To verify the changes made in the Right margin should be reflected on the canvas,Not Automated,
78475,Verify the default value of 'Top Margin',Not Automated,
78476,To verify that Top Margin property is editable,Not Automated,
78477,To verify the changes made in the Top margin should be reflected on the canvas,Not Automated,
78478,Verify the default value of 'Bottom Margin',Not Automated,
78479,To verify that Bottom Margin property is editable,Not Automated,
78480,To verify the changes made in the Bottom margin should be reflected on the canvas,Not Automated,
78481,To Verify that the user should be able to drag and drop multiple checkbox control from Toolbox,Planned,
78482,To verify that List view control should show report heading for radio button and it should be selectable by user,Not Automated,
78483,To verify the behaviour of Web console if user clicks on <back to manage app>  when the App containing new values of checkbox is not saved,Planned,
78484,To verify the behaviour of Web console if user clicks on <back to manage app>  when the App containing new values of checkbox is saved,Planned,
78485,Verify that user when user navigate from one control to other on an app on the IDE canvas the new values for checkbox and other controls should remain intact.,Not Automated,
78486,Verify that user is able to delete the checkbox control from canvas,Planned,
78487,Verify that when user navigate from one page to other on an app on the IDE canvas the new values for checkbox and other controls should remain intact.,Not Automated,
78544,Verify that an admin should be allowed to arrange an already dropped controls on canvas by dragging up and down.,Not Automated,
78545,Verify that the changes made by draging/re-ordering a control should be visible on the canvas.,Not Automated,
78546,Verify that if a control is dragged out of canvas then it should retain its old position in the web form.,Not Automated,
78547,Verify that the changes made by admin on a Canvas should persist between different pages.,Not Automated,
78548,Verify that the form with re-ordered controls should render on the agent in a same.,Not Automated,
78549,Verify that the re-ordered controls should only take effect if admin has saved it.,Not Automated,
78550,Verify that there should not be any error in the form if user re-orders any control on a form.,Not Automated,
78551,Verify that the warning button available in header section displays when atleast one warning is there and publish is attempted from inside of IDE,Not Automated,
78552,Veirfy that the errors visible in the Errors tab should be indicated in red color.,Not Automated,
78553,Verify that the Warning count visible on the Error list is the total number of warning present in the app.,Not Automated,
78554,Verify the functionality of fix errors on publish warning popup.,Not Automated,
78555,Verify that admin is not able to save any app if the error list contains a single error.,Not Automated,
78556,Verify that if user removes any control from canvas containing warning then all warnings associated with that control does not display in warning list.,Not Automated,
78557,Verify that if user removes any page containing warning then all warning associated with that page is removed from the warning list.,Not Automated,
78570,Verify user can view the radio button control on agent,Not Automated,
78572,Verify user can view the radio button with its default value that was selected on console,Planned,
78573,Verify user can view that  no default value is appearing for radio button if no value is selected at console,Planned,
78574,Verify user can select any radio button value on agent,Planned,
78575,Verify user can only select one value from radio control,Planned,
78576,Verify the multiple checkbox behaviour in an application,Planned,
78577,Verify the order of the radio button values should be same as configured on console.,Planned,
78578,Verify the radio button value should display on List view,Planned,
78579,Verify the radio button value is getting saved on SQLite,Not Automated,
78580,Verify that user is able to edit the radio button value on agent through listview,Planned,
78581,Verify  that the value selected initially for radio button should come preselected on edit mode of the record and is editable and gets saved on App. The new value is visible on List view,Planned,
78582,Verify the value of radio button can be changed in edit mode,Not Automated,
78583,Verify the updated value after editing the record is displaying on list view.,Not Automated,
78584,Verify the updated radio button value is getting saved on SQLite,Not Automated,
78643,Duplicate 78551: Verify that error section should not display if there is no error in form.,Not Automated,
78644,Verify that number of warning count on warning list label on IDE page.,Not Automated,
78645,Verify that for multipage app all the warning from all the pages are being displayed in warning list.,Not Automated,
78646,Verify that error list appear on screen when click on error button on IDE page.,Not Automated,
78647,Verify that warning count & warning list gets updated accordingly if user corrects the warning(s).,Not Automated,
78648,Verify that warnning count & error list gets updated accordingly if user introduces the warning(s).,Not Automated,
78649,Verify that if user leaves "Display Text" field blank for any control then "Display Text is required" error should display error list.,Not Automated,
78650,[Label specific]: Verify that if there is invalid/ blank value in "Font Color" then error should display in error list accordingly.,Not Automated,
78651,[Label specific]: Verify that if user leaves the "Font Size" as blank then "Value should be between 1 - 99." error should display in error list.,Not Automated,
78652,Verify that if user leaves "Margin" field blank then "Value should be between 0 - 99." error should display in error list.,Not Automated,
78653,Verify that if user leaves the "Report Heading" field blank then "'Report Heading' is required." error should display in error list.,Not Automated,
78654,[Radio button specific]: Verify that for two radio button if user provide the same "Value" then "'radio Option Value' should be required & unique." error should display in error list.,Not Automated,
78655,Verify that  user is able to "Save" / "Auto Save" or Preview the app with any number of warnings.,Not Automated,
78656,Verify that user should not be able to save the app containing errors.,Not Automated,
78695,Duplicate for 78646: Verify thar error list should close when user remove the cursor from it.,Not Automated,
78735,Verify user should get delete confirmation box,Not Automated,
78736,Verify the control should get delete if user press delete button,Not Automated,
78737,Verify the control should not get deleted if user press cancel close or Esc button,Not Automated,
78738,Verify the control should not get deleted if user press close button,Not Automated,
78739,Verify the control should not get deleted if user press Esc,Not Automated,
78740,Verify Margin property on all controls,Not Automated,
78741,Verify the report heading property in every control is changed to Name,Not Automated,
78742,Verify the radio button options can be reordered,Not Automated,
78743,Verify the radio control reordering should sync with Agent,Not Automated,
78952,Verify that user should be able to change the splash screen images and save it. The Changes are available on the next time edit,Not Automated,
78953,Verify that user should be able to Add the splash screen images and save it. The Changes are available on the next time edit,Not Automated,
78954,Verify that user should be able to change the Page order and save it. The Changes are available on the next time edit,Not Automated,
78955,Verify that user should be able to delete a Page and save it. The Changes are available on the next time edit,Not Automated,
78956,Verify that user should be able Add a page and save it. The Changes are available on the next time edit,Not Automated,
78957,Verify that user should be able to Add label controls to different pages of app and save it. The Changes are available on the next time edit,Not Automated,
78958,Verify that user should be able to delete label controls from different pages of app and save it. The Changes are available on the next time edit,Not Automated,
78959,Verify that user should be able to change properties of label controls on different pages and save it. The Changes are available on the next time edit,Not Automated,
78960,Verify that user should be able to Add Textbox controls to different pages of app and save it. The Changes are available on the next time edit,Not Automated,
78961,Verify that user should be able to delete Textbox controls from different pages of app and save it. The Changes are available on the next time edit,Not Automated,
78962,Verify that user should be able to change properties of Textbox controls on different pages and save it. The Changes are available on the next time edit,Not Automated,
78963,Verify that user should be able to Add Radio Button controls to different pages of app and save it. The Changes are available on the next time edit,Not Automated,
78964,Verify that user should be able to delete Radio Button controls from different pages of app and save it. The Changes are available on the next time edit,Not Automated,
78965,Verify that user should be able to change properties of Radio Button controls on different pages and save it. The Changes are available on the next time edit,Not Automated,
78966,Verify that user should be able to Add Checkbox controls to different pages of app and save it. The Changes are available on the next time edit,Not Automated,
78967,Verify that user should be able to delete Checkbox controls from different pages of app and save it. The Changes are available on the next time edit,Not Automated,
78968,Verify that user should be able to change properties of Checkbox controls on different pages and save it. The Changes are available on the next time edit,Not Automated,
78969,Verify that user should be able to Add Camera controls to different pages of app and save it. The Changes are available on the next time edit,Not Automated,
78970,Verify that user should be able to delete Camera controls from different pages of app and save it. The Changes are available on the next time edit,Not Automated,
78971,Verify that user should be able to change properties of Camera controls on different pages and save it. The Changes are available on the next time edit,Not Automated,
78972,Verify that user should be able to Add Dropdown controls to different pages of app and save it. The Changes are available on the next time edit,Not Automated,
78973,Verify that user should be able to delete Dropdown controls from different pages of app and save it. The Changes are available on the next time edit,Not Automated,
78974,Verify that user should be able to change properties of Dropdown controls on different pages and save it. The Changes are available on the next time edit,Not Automated,
78975,Verify that user should be able to Add Button controls to different pages of app and save it. The Changes are available on the next time edit,Not Automated,
78976,Verify that user should be able to delete Button controls from different pages of app and save it. The Changes are available on the next time edit,Not Automated,
