ID,Title,AutomationStatus,
66140,Verify that MADP agent supports multiple paging option and Data should remain intact on navigating from one page to another .,Not Automated,
66142,Verify that the apps (Active and Paused both) deleted by Customer Admin doesn't appear in  App Catalogue.,Planned,
66145,Verify that MADP agent ignores a Delete command if the relevant application is not yet installed on the device.,Planned,
66147,Verify the icon of a web application should change when MADP agent receives a 'Blocked' status for any installed application.,Planned,
66148,Verify the behavior of MADP agent when the web app's state changes from 'Active' to 'Blocked'.,Planned,
66149,Verify the behavior of MADP agent when the web app's state changes from 'Blocked' to 'Active'.,Planned,
66150,Verify the behavior of MADP agent when it recieves a 'Blocked' status for an app which is not yet installed in the app catalogue.,Planned,
68240,Verify that the MADP agent doesnot show the paging icon state if there is only one page present.,Not Automated,
68241,Verify the behavior of MADP agent when user tries to scroll left and app is currently on the first page.,Not Automated,
68242,Verify the behavior of MADP agent when user tries to scroll right and app is currently on the last page.,Not Automated,
68243,Verify the page layout on the app catalogue screen.,Not Automated,
68261,Verify that if app is not installed on agent and it is in "Active" state on server then server should send "Install" command to agent.,Not Automated,
68262,Verify that if app is not installed on agent and it is in "Deleted" state on server then server should not send any command to agent for that specific app.,Not Automated,
68263,Verify that if app is not installed on agent and it is in "Blocked" state on server then server should not send any command to agent for that specific app.,Not Automated,
68264,Verify that if state at server is "Active" and version has not changed then server should not send any command to agent for that specific app.,Not Automated,
68265,Verify that if app is installed on agent as "Active" and state at server is "Blocked" then server should send "Pause" command.,Not Automated,
68266,Verify that if the app is installed on the agent and state at server is "Deleted" then server should send "Delete" command.,Not Automated,
68267,Verify that state of app on the agent is "Paused" and if state at server is "Active" then server should send "Activate" command.,Not Automated,
68268,Verify that if the State of app at agent is "Paused" and if state at server is "Paused" then server should not send any command.,Not Automated,
68269,Verify that the state of app at agent is "Paused" and if state at server is "Deleted" then server should send "Delete" command.,Not Automated,
68307,Verify that the zip file downloaded by the agent goes to the correct location (i.e. Internal storage) on the device.,Not Automated,
68308,Verify that the AppConfig.json file contains the information about following database tables.,Not Automated,
68309,Verify that there is a table with name 'SyncWorkFlow' created on the agent side.,Not Automated,
68310,Verify that there should be a table with name 'AppConfiguration' on the agent side.,Not Automated,
68311,Verify that there should be a table with name 'InstallationWorkFlow' on the agent side.,Not Automated,
68312,Verify that there should be a table with name 'FormTable' on the agent side.,Not Automated,
68313,Verify that the tables on the agent side gets populated whenever a new app is installed on the device.,Not Automated,
68314,Sanity test,Not Automated,
68334,Verify the behaviour of MADP agent when there is no space in interval memory and server push some apps on the agent.,Not Automated,
68356,Verify that if server issues a Pause command then agent respond in their next sync.,Not Automated,
68358,Verify the options when user clicks on the actions button.,Not Automated,
68359,Verify that if server issues a Delete command then agent respond in their next sync.,Not Automated,
68379,WebConsole | Verify that for an admin can create a new app only when fills a 'Create new app' form present on the web console.,Not Automated,
68380,WebConsole | Verify that there should be proper validation for the 'app name' of the web app passed by the admin while creating new app page.,Not Automated,
68381,WebConsole | Verify that there should be proper validation for the 'app icon' of the web app passed by the admin while creating new app page.,Not Automated,
68382,Verify that there should be proper validation for the number of characters in the 'Description' of the web app passed by the admin while creating new app page.,Not Automated,
68386,Verify the database entires in the table for newly created apps.,Not Automated,
68456,Verify that nothing is saved in the database if user discards 'New app' form page.,Not Automated,
68483,Verify that if app is not installed on agent and it is in "Active" state on server then server should send "Install" command to agent.,Not Automated,
68484,Verify that if app is not installed on agent and it is in "Deleted" state on server then Web console (server) should not send any command to agent for that specific app.,Not Automated,
68485,Verify that if app is not installed on agent and it is in "Blocked" state on server then server should not send any command to agent for that specific app.,Not Automated,
68486,Verify that if state at server is "Active" and version has not changed then server should not send any command to agent for that specific app.,Not Automated,
68487,Verify that if app is installed on agent as "Active" and state at server is "Blocked" then server should send "Pause" command to the agent.,Not Automated,
68488,Verify that if the app is installed on the agent as "Active" and state at server is "Deleted" then server should "Delete" that app from the device.,Not Automated,
68489,Verify that state of app on the agent is "Blocked" and if state at server is "Active" then server should send "Activate" command to the device.,Not Automated,
68490,Verify that if the State of app at agent is "Blocked" and if state at server is "Blocked" then server should not send any command on the device.,Not Automated,
68491,Verify that the state of app at agent is "Blocked" and if state at server is "Deleted" then app should get deleted from the agent.,Not Automated,
68516,Verification of error/ confirmation messages on web console.,Not Automated,
68600,Verification of schema generation using JSON with multiple data types and 1 primary key.,Not Automated,
68601,Verify that the database fails to generate schema via JSON file which consists of multiple data types and with primary key empty.,Not Automated,
68617,Verify that the database fails to generate schema via JSON file which consists of multiple data types and with primary key that does not exist.,Not Automated,
68618,Verify that the schema generated via JSON file consists of multiple data types and with valid composite key .,Not Automated,
68619,Verify that the agent fails to generate schema via JSON file which consists of multiple data types and with an invalid composite key in which one of the  columns exist.,Not Automated,
68620,Verify that the agent fails to generate schema via JSON file which consists of multiple columns of same name and has composite key.,Not Automated,
68621,Verify that the JSON does not generate schema if the JSON file is not properly formatted.,Not Automated,
68622,Verify that the agent fails to generate schema via JSON file which consists of a column with same name and has primary key.,Not Automated,
68623,Verify that the schema generated via JSON file consists of multiple data types and with valid composite key but all of the columns in composite key have same name,Not Automated,
68624,Verify that the database fails to generate schema via JSON file which consists of multiple data types and with composite key completely empty.,Not Automated,
68625,Verify that the database fails to generate schema via JSON file which consists of multiple data types and with composite key partially empty.,Not Automated,
68659,Verify that the schema generated for an application deletes automatically once the application is removed from the device/ app catalog.,Not Automated,
68663,Verify service response 204 when incorrect values with correct format for parameters are passed in the request,Not Automated,
68676,Verify that application should roll back  if the schema of that application was not created successfully.,Not Automated,
68677,Verify that the Schema is created on the Agent side SQLite when schema.json contains field decorator type as csv for all the DataTypes,Not Automated,
68679,Verify the values of supported datatypes for a column in the SQLite present on the Agent,Not Automated,
68680,Validate the column in the table on agent side uses Datatype field from schema.json and ignores DecoratorType value if Junk or Blank data is passed in schema.json,Not Automated,
68681,Verify that database throws error when user tries to create 2 tables with same name.,Not Automated,
68682,Verify that database throws error message if user tries to create a table which contains 2 columns of same name.,Not Automated,
68683,Verify that database server throws an error whe user tries to create a table which does not contain a primary key.,Not Automated,
68684,Verify that 2 columns 'Created date' & 'Modified date' should automatically get assigened to each table.,Not Automated,
68685,Verify that user is able to create DB table using a valid JSON file.,Not Automated,
68686,Verification of schema generation using JSON with multiple data types and 1 primary key.,Not Automated,
68687,Verify that the database fails to generate schema via JSON file which consists of multiple data types and with primary key empty.,Not Automated,
68688,Verify that the database fails to generate schema via JSON file which consists of multiple data types and with primary key that does not exist.,Not Automated,
68689,Verify that the schema generated via JSON file consists of multiple data types and with valid composite key .,Not Automated,
68690,Verify that the agent fails to generate schema via JSON file which consists of multiple data types and with an invalid composite key in which one of the  columns exist.,Not Automated,
68813,Verify that the project.explorer launches on web console using a pre-defined service.,Not Automated,
68828,Verify the Toolbar window on the screen.,Not Automated,
68829,Verify the navigation bar present on the top of the screen.,Not Automated,
68830,Verify the format of control.json file.,Not Automated,
68831,Verify that if user/admin pass a valid control.json file then then extry gets saved in the database file.,Not Automated,
68832,Verify that nothing is stored in the data base when control.json is of invalid format. (response),Not Automated,
68833,Verify that entries in the database gets updated for the same app if control.json is used for the same app with updated records,Not Automated,
68952,Verify the error on deleting the table name.,Not Automated,
68953,Verify new Table is created in DB when making required changes to the JSON file,Not Automated,
68954,Verify the proper Error should be generated and Table should not be created in DB on passing a blank table name in the Json File.,Not Automated,
68956,Verify that Duplicate Tables are not created in DB.,Not Automated,
68957,Verify table is not created in DB on removing the  FieldId OR DbFieldName from Json file.,Not Automated,
68958,Veify table is not created in DB if DataType is Blank in schema.json,Not Automated,
68959,Verify table is not created in DB and error is generated when Length Type is to some Decimal Value,Not Automated,
68960,Verify table is not created in DB and error is generated when Length Type is Blank,Not Automated,
68961,Verify table is not created in DB and error is generated when IsRequired property is set to Blank.,Not Automated,
68962,Verify table is not created in DB and error is generated when IsRequired propety is set to an Integer Value,Not Automated,
68963,Verify table is not created in DB and error is generated if IsRequired property is not available in a Json file.,Not Automated,
68964,Verify table is not created in DB and error is generated when DataType is not available in Json file.,Not Automated,
68965,Verify table is not created in DB and error is generated when user set Length of Property as a String value.,Not Automated,
68966,Verify table is not created in DB and error is generated when DBFieldName property is missing from Json File.,Not Automated,
68967,Verify table is not created in DB and error is generated when FieldId is not generated in Json file.,Not Automated,
68968,Verify table is not created in DB and error is generated when  Jint is passed as jint .,Not Automated,
68969,Verify table is not created in DB and error is generated when changing the  FieldId to fieldId in json file.,Not Automated,
69020,Verify that,Not Automated,
69022,Verify that Create App screen should not distort if resolution is set below 1024*800,Not Automated,
69023,Verify that Create App screen should render as per visual designs if the resolution is set above 1024*800,Not Automated,
69024,Verify that Create App Page should not distort when resolution is set to 1024*800,Not Automated,
69026,Verify that Manage App screen should not distort if resolution is set below 1024*800,Not Automated,
69027,Verify that Manage App screen should render as per visual designs if the resolution is set above 1024*800,Not Automated,
69028,Verify that Manage App Page should not distort when resolution is set to 1024*800,Not Automated,
69098,User data should not be retained if page is refreshed when user is on Create App Page on has entered the data in the fields.,Not Automated,
69100,Verify the action on clicking "Create App & Continue" in Offline Mode .,Not Automated,
69102,Verify the impact on clicking "Create App and Continue" multiple times when user is already creating an app existing in DB.,Not Automated,
69103,Verify the action while toggling in side nav between Dashboard and Apps in offline mode.,Not Automated,
69104,Verify server action on creation of an app on uploading the app image sizes as (192*193  193*192193*193 )px,Not Automated,
69105,Verify clicking LOG OUT button in offline mode.,Not Automated,
69106,Verify uploading the app icon image sizes as (599kb598kb601kb602kb),Not Automated,
69107,Verify uploading the app icon images multiple times(Deafult Icon-Upload the image-Deafult icon...) and then creating the app.,Not Automated,
69108,Verfiy the action clicking any bookmarked URL in Online or Offlin Mode.,Not Automated,
69111,Verify expanding and collapsing the side nav multiple times in Online or Offline Mode.,Not Automated,
69112,Verify the behaviour on clicking browser back button when user has clicked logged out at any screen.,Not Automated,
69113,Verify modifying the URL in address bar and running it.,Not Automated,
69124,App Data Insertion in SQlite dB,Not Automated,
69126,Verify that on clicking submit button all the data should get saved into the correct table inside the SQLite db.,Not Automated,
69128,Verify that invalid data from App(HTML form) should not be saved in SQLite.,Not Automated,
69130,Verify that entire command for Adding App data to SQLite should be rolled back if a single query condition goes wrong e.g. in case of non-submission of invalid data from form the valid data on the form also should not be submitted,Not Automated,
69131,Verify that Apps information should be stored in their Respective Tables in SQLite.,Not Automated,
69133,Verify that if user doesn't fill/select any of the mandatory field in form then error message should get displayed to user with error prone field.,Not Automated,
69134,Verify that any data entered in the input text field (not selected any checkbox) is saved inside the correct table in SQLite db.,Not Automated,
69135,Verify that any data selected from the check box (with empty text box) is saved inside the correct table in SQLite db.,Not Automated,
69137,Verify that if there is mismatch in mapping between appconfig.json schema.json index.html & appModels.json then entered data should not save in db.,Not Automated,
69138,Verify that data entered in the form is only saved in the SQLite table if it is of same data type as the column in SQLite db.,Not Automated,
69139,Verify that if user enter the data as int float Boolean string date-time then in SQLite dB it should get saved as int real Boolean text numeric respectively.,Not Automated,
69140,Verify that if user select multiple checkbox at one time then data should be saved in the respective column of table of dB as comma separated value as per the field decorator.,Not Automated,
69145,Verify that data entered in multiple textbox of different data types and selected multiple check box of different data types is saving in SQlite dB.,Not Automated,
69146,Verify that data entered in multiple textbox of different data types and selected single check box is saving in SQlite dB.,Not Automated,
69147,Verify that data entered in single textbox & selected multple check box of different data types is saving in SQlite dB.,Not Automated,
69174,Verify that data of two text fields(datatype: int & float) multi select checkbox (String) & single select checkbox (Float) is saving in SQlite dB.,Not Automated,
69175,Verify that data of two text fields(datatype: string & int) multi select checkbox(float) & single select checkbox(int) is saving in SQlite dB.,Not Automated,
69176,Verify that data of two text fields(datatype: string & float) multi select checkbox(int) & single select checkbox(string) is saving in SQlite dB.,Not Automated,
69177,Verify the data of multiple text box with different data types and multiple & single types of check box is saving in SQlite dB.,Not Automated,
69178,Verify that data of text field (string) & multi select checkbox(int) is saving in SQlite dB.,Not Automated,
69179,Verify that data of text field (string) & multi select checkbox(float) is saving in SQlite dB.,Not Automated,
69180,Verify that data of text field (int) & multi select checkbox(string) is saving in SQlite dB.,Not Automated,
69181,Verify that data of text field (string) & single select checkbox(boolean) is saving in SQlite dB.,Not Automated,
69183,Verify that data of multi select checkbox(int) & single select checkbox(boolean) is saving in SQlite dB.,Not Automated,
69270,Verify that the admin is able to replicate the save work flow using Save API.,Not Automated,
69271,Verify that admin can edit an app which is already present in the list/ database.,Not Automated,
69272,Verify that user lands to IDE page from Create App page and should be able to see the UI as per Visual designs,Not Automated,
69362,Verify new table is created when the field name and table Name is changed and an existing Table with no primary key is passed in the json.,Not Automated,
69363,Verify table is not created when primary key field ID is left empty.,Not Automated,
69364,Verify  table is created with new column boolean and float apart from the default ones,Not Automated,
69365,Verfiy table is created with custom fields and the default column names are updated if any changes are made in Madp.Services.api.exe,Not Automated,
69366,Verify a table withe 2 primary keys should not be created.,Not Automated,
69367,Verify table should not be created having unknown decorator type.,Not Automated,
69368,Verify table is not created if length param is removed for integer fieldsfrom JSON.,Not Automated,
69369,Verify table is created if For integer fields 0 and -1 are passed in length param,Not Automated,
69370,Verify table is not created if length param is removed for String fields from JSON,Not Automated,
69371,Verify table is not created if 0 and -1 are passed in length param for String fields in JSON.,Not Automated,
69372,Verify that the api updates the database by only matching the controlJsonID.,Not Automated,
69373,Verify  two tables are created when primary key for one acts as foregin in the other.,Not Automated,
69374,Verify table is not created on removing not null constraint from column that needs to be primary key.,Not Automated,
69375,Verify table is created if we make a foreign key from other table that is not a part of JSON,Not Automated,
69376,Verify values are inserted in the tables with primary and forgien key constraint.,Not Automated,
69377,Verify Data Insertion in DB,Not Automated,
69378,Verify that api updates the counter of the controljson each time admin hits the same app id.,Not Automated,
69380,Verify table is not created if we change one of the data  type for composite key while refering as foreign,Not Automated,
69381,Verfiy table is created if we create foreign reference for composite key in tables mentioned in JSON,Not Automated,
69382,Verify table is created on creating a bulky Schema with 5 tables.,Not Automated,
69383,Verify the functionality of controlJsonId in edit IDE feature.,Not Automated,
69384,Verify that the API load the IDE when user pass a valid information in the get request.,Not Automated,
69464,Verify no other control is present on canvas when user clicks Create App and Continue from Create App page.,Not Automated,
69467,Verify Admin is able to Drag and Drop textbox control within canvas.,Not Automated,
69468,Verify Admin is able to Drag and Drop Checkbox control within canvas.,Not Automated,
69471,To verify that Agent user receives successfull sync notification on clicking sync button,Not Automated,
69472,To verify that App data for the selected App only should be extracted and (only last saved record) synced with Server.,Not Automated,
69473,Verify the textbox placing if another control is already present within canvas.,Not Automated,
69474,Verify the checkbox placing if another control is already present within canvas.,Not Automated,
69475,Verify that Data Sync should not fail when Internet connectivity is slow,Not Automated,
69476,MADP_112 Verify that Data Sync failure should be gracefully handled when Internet connectivity is removed,Not Automated,
69477,MADP_112 Verify that Data Sync should be handled gracefully when phone battery is drained out suddenly,Not Automated,
69478,MADP_112 Verify that Data sync should be handled gracelfully when Device Autolock happens,Not Automated,
69479,MADP_112 Verify that Interrupts should not impact Data Sync and it should carry on parallely with formers,Not Automated,
69480,MADP_112 Verify that Sync should carry on when Application is taken to background and then brought back to foreground specially incase of multitasking,Not Automated,
69481,Verify that user should be able to edit the app info from IDE,Planned,
69482,Verify that on clicking on gear icon edit app info overlay should display and close on clicking cross or click escape,Not Automated,
69483,Verify that on clicking edit app a "GET" request will make & respective app will open for user to edit.,Not Automated,
69484,Verify that all the pre-saved data is loaded & displayed correctly to user on editing app.,Planned,
69485,Verify that all the field related validations should remain intact on editing an app similarly as on create new app page.,Planned,
69486,Verify that user should be able to edit the information of every field (Name Description & app icon).,Planned,
69487,Verify that while editing an app "Save& continue" button should be enables &  is clickable to user to save the edited app's data at any time.,Planned,
69488,Verify that on clicking "Update App & Continue" button a "Post" request will make & save the modified app data in dB.,Not Automated,
69489,Verify that there should be any visual indication to user (alert pop up toast message etc) to ensure the user that the modified data is saved successfully.,Planned,
69490,Verify that on clicking the "Save & Continue" user should be redirected to IDE,Planned,
69491,Verify automatic scroll happens if admin has added more controls then the current height of the canvas drop-zone.,Not Automated,
69492,Verify that all the modified data should get reflected on manage app page (i.e icon name description etc) after clicking on "save & Continue" button.,Planned,
69493,Verify that all the modified app data is reflected in dB in respective table/fields and on front end when user access the App info flow again (please add steps),Not Automated,
69494,Verify that recently edited app should displayed at the top in the list of apps(drafts) on manage apps page.,Not Automated,
69495,Verify that no field data should get modified in dB if user modify the data of any app & doesn't click on "Save" button (or clicks on "log out" button or close the browser).,Not Automated,
69496,Verify that there should be a "Cancel" button on edit app page & clickable to user.,Not Automated,
69497,Verify that on clicking "Cancel" button there should not be any updation in the data on app level & on dB level.,Not Automated,
69498,Verify that on clicking the Cancel button OR cross icon all the changes should be discarded & manage app page should display to user.,Planned,
69499,Verify the canvas is in between the canvas area in portrait and landscape mode.,Not Automated,
69502,Verify No Action takes place if admin releases the dragged control out of the canvas.,Not Automated,
69503,Verify the spacing between the 2 controls should be as per the css stylesheet provided.,Not Automated,
69504,Verify scroll bar is not visible until admin has added more controls then the current height of the canvas drop-zone.,Not Automated,
69578,Verify the behavior of Sync functionality when no data exists for an App in  SQLite,Not Automated,
69600,Verify that a web console admin is able to load the IDE (canvas) page using a get request.,Not Automated,
69601,Verify that admin is not able to launch the IDE (canvas) using a get request if it passes any invalid parameter.,Not Automated,
