ID,Title,AutomationStatus,
69602,Verify that all the records present in SQLite against App<App name> are Synced with server on click of Sync button.,Not Automated,
69688,Verify that on updating of any app "Modified On" and modified by column time stamp should get updated in dB and hence on app catalog,Not Automated,
69793,Device Agent | Verify that for a particular tenant zip file gets created on a specific hierarchical location.,Not Automated,
69794,Device Agent | Verify that the zip file consists of proper file structure as mentioned by the DEV team.,Not Automated,
69795,Device Agent | Verify that the zip file gets extracted on the device agent and renders all the files while showing a web view on device agent.,Not Automated,
69796,Device Agent | Verify that the schema created on the device DB contains same info as mentioned in the schema.json.,Not Automated,
69797,Device Agent | Verify that the index.html file present in the zip file is same at the time of form creation.,Not Automated,
69798,Device Agent | Verify that the zip file contains the same icon which was uplaoded by the admin at the time of app export.,Not Automated,
69799,Device Agent | Verify that the AppConfig.json present in the zip file should be of proper format.,Not Automated,
69800,Device Agent | Verify that the data synced by the agent should get saved in JSON repository table..,Not Automated,
69801,Device Agent | verify that if any of these files gets corrupted then the web app should rollback on the device agent.,Not Automated,
69852,To verify that a zip file will be generated when you export the app and stored at the location mentioned as base url.,Not Automated,
69853,To verify the location where zip file is placed and corresponding entry in the appconfiguration table.,Not Automated,
69854,To verify the folder structure of the Zip file,Not Automated,
69855,To verify the files present  per folder level inside th Zip file,Not Automated,
69856,To verify that Sync service is running successfully after File packaging,Not Automated,
69857,To verify that Download service is running successfully after Sync has been completed,Not Automated,
69858,To verify that Admin sees the publish button on IDE and is enabled for Admin,Not Automated,
69859,To verify that when Admin clicks on publish button without dropping any control to canvas he should be prompted with Alert asking his consent to save empty Canvas,Not Automated,
69860,To verify that Admin is able to Save the dropped in-scope controls and button on the canvas using Save button and gets a successfull save toast message when Autosave is not triggered.,Not Automated,
69861,To verify that Admin is taken to Web Console’s Manage App page on click on Manage Apps button and saved app is being displayed on top of the list with Status "Draft".,Not Automated,
69862,To verify that user should see Database entries made to Appconfig table under AppConfigdata ControlJSON and Schema JSON column in AppConfigurations JSON repository and App tables should be created at server side on export,Not Automated,
69863,To verify that following files will be generated on click of Export and stored at respective location:1. AppConfigJSON 2. ScemaJSON 3. FormJSON 4. Index.html 5. Model.js 6. Bal.js 7. <>.css 8. ProjectConfigJSON <Not for Sprint-11>,Not Automated,
69864,To verify the Location structure and content of SchemaJSON with respect to the App created at canvas,Not Automated,
69865,To verify the Location structure and content of ProjectJSON with respect to the App created at canvas,Not Automated,
69866,To verify the Location structure and content of FormJSON with respect to the App created at canvas,Not Automated,
69867,To verify the Location structure and content of Index.html with respect to the App created at canvas,Not Automated,
69868,To verify the Location structure and content of AppModel.js with respect to the App created at canvas,Not Automated,
69869,To verify the Location structure and content of Bal.js with respect to the App created at canvas,Not Automated,
69870,To verify the Location structure and content of icon.pngwith respect to the App created at canvas,Not Automated,
69871,To verify the Location structure and content of AppConfigJSON  with respect to the App.,Not Automated,
69872,Verify that user is able to save and export a multicontrol App with scrollable canvas.,Not Automated,
69873,To verify the system behavior when user drops some control on canvas and clicks on 'Back To Manage Apps ' on header,Not Automated,
69874,To verify that device agent should display a message "No apps found" if no web app is available for that tenant on the WC.,Planned,
69875,To verify that the device agent polls for the new info on server each time it is fresh launched or Pull to refresh app catalog screen,Planned,
69876,Verify that the device agent render the app in a same way it was created by the admin on web console. (Scenario: 1 text box + button).,Not Automated,
69879,Verify that the device agent render the app in a same way it was created by the admin on web console. [Scenario:  5X {a button after 2 text boxes}].,Not Automated,
69880,Verify that the "No App Found" message only appears on device agent when the app catalog is empty i.e. no app present of the tenant on the web console.,Not Automated,
69886,Verify that the user is able to Submit and sync the data from Agent App to the SQL server by using sync button.,Not Automated,
69887,Verify that if admin blocks an app on webconsole same is reflected on the device agent (on next sync).,Not Automated,
69888,Verify that if admin delete(s) an app on web console the same app gets deleted on the device agent (on next sync) .,Not Automated,
69893,Verify that app Catalog imbeds pagination if the apps count doesnot fit in first page.,Not Automated,
69912,Verify form elements such as labels and placeholder texts on create App page.,Not Automated,
69913,Verify that 'create app & continue' button button gets enabled only if user pass atleast 2 alpha numeric character as App Name.,Not Automated,
69914,Verify that 'Create app and Continue' button should get disabled if App name contains less than 2 characters.,Not Automated,
69915,Verify that placeholder text appears back if user enter the text in text fields & clear it,Not Automated,
69927,Verify the validation errors displayed on create app page.,Not Automated,
69928,Verify that webconsole admin is able to create an app using a default icon and app name consists of only 2 numeric characters.,Not Automated,
69929,Verify that admin is able to create an app with default image and  app name consists of 20 Numbers.,Not Automated,
69930,Verify that admin can create an app with default image and app name consists of 20 alphabets.,Not Automated,
69932,Verify that webconsole admin is able to create an app using a default icon and app name consists of only 2 alphabets.,Not Automated,
69935,Verify that webconsole admin is able to create an app using a default icon and app name consists of only 2 alphanumeric characters.,Not Automated,
69938,Verify that admin is able to create an app with default image and app name consists of 20 alphanumeric characters.,Not Automated,
69941,Verify that webconsole admin is able to create an app using a valid icon and app name consists of only 2 numeric characters.,Not Automated,
69943,Verify that an admin can create an app with valid image and  app name consists of 20 Numbers.,Not Automated,
69945,Verify that an admin can create an app with valid image and  app name consists of 20 alphabets.,Not Automated,
69947,Verify that an admin can create an app with valid image and  app name consists of 2 alphabets.,Not Automated,
69949,Verify that an admin can create an app with valid image and  app name consists of 2 alphanumeric characters.,Not Automated,
69953,Verify that an admin can create an app with valid image and  app name consists of 20 alphanumeric characters.,Not Automated,
69956,Verify that an admin can create an app with valid image and app name consists of multiple space(s) in between 2 word.,Not Automated,
69962,Verfies that webconsole throws an error if an image is used with resolution other then 192 x 192.,Not Automated,
69964,Verfies that webconsole throws an error if the format of image is other than png.,Not Automated,
69967,Verfies that webconsole throws an error if the file size if more than 600kb.,Not Automated,
69971,Verify action menu corresponding to Active app,Planned,
70009,Verify action menu corresponding to Blocked app,Planned,
70010,Verify action menu corresponding to DRAFT app,Planned,
70011,Verify Delete App Confirmation message - Published,Not Automated,
70012,Verify the alert confirmation message appears on screen when an admin tries to publish an app which is in Draft state.,Planned,
70013,Verify Delete App Confirmation message - Draft,Not Automated,
70015,Verify that user should be able to Publish the App present in draft state on Web Console from Action menu.,Not Automated,
70016,Verify that user is able to Edit App info multiple times but on publish the latest change should be included in the file Package,Not Automated,
70017,To Verify the size of Zip file reflected on database and WebConsole on Export,Not Automated,
70192,Execute test cases for App data insertion,Not Automated,
70193,Eexcute test cases for App data sync,Not Automated,
70194,Verify through Charles proxy  that data is extracted from local storage and converted to server compatible JSON format.,Not Automated,
70195,Call test cases for export app from sprint-11 (creation of App table carrying field specific to all input controls  with three extra fields  ID Date CreatedDate Modified).,Not Automated,
70196,Execute the test cases for App data sync,Not Automated,
70197,Verify through Charles proxy  that data is extracted for sync from local storage and converted to server compatible JSON format.,Not Automated,
70198,Execute test cases for App data sync and storage in JSONrepository from Sprint-10,Not Automated,
70199,Verify that JSON file stored in JSON repository for the app data travelling from Agent all field names and values should be present along with additional values for  Record ID Date created Date Modified.,Not Automated,
70200,Verify that all the values provided in App form on the Agent side are stored successfully in correct fields on the specific App table on MADPDB,Not Automated,
70201,Verify that record ID should be the primary Key for App table.,Not Automated,
70202,Verify that user is able to drag and drop the camera control Canvas for an App (containing Text box and button),Not Automated,
70203,Verify that App is installed on Agent successfully with Camera control,Not Automated,
70204,Verify that Camera button should be displayed on the App on the position where it was included in the zip file,Not Automated,
70205,Verify that when user clicks on the camera button it should open the camera on the device,Not Automated,
70206,Verify that when user clicks on device back button from camera app he should be taken to Application with the state he left it.,Not Automated,
70207,To verify that a a user is able to creat an app having Labels Text boxes Single Select Checkboxes Multi select check box  Camera Control and button  and successfully export it to the Agent,Not Automated,
70208,For App created verify that user is able to enter data and store the same in Local DB on Agent using Submit button on the App form,Not Automated,
70209,To verify that an app  with controls  for Labels Text boxes Single Select Checkboxes Multi select check box  Camera Control and button is rendered successfully on Agent  and a local storage DB for the app is created on SQLite DB,Not Automated,
70210,Execute scenarios for App data insertion,Not Automated,
70211,Execute scenarios for App data sync,Not Automated,
70213,To verify that an app  with controls  for single select Checkbox  and button is rendered successfully on Agent and a local storage DB for the app is created on SQLite DB,Not Automated,
70215,For App created in TC-70213 verify that user is able to enter data and store the same in Local DB on Agent using Submit button on the App form,Not Automated,
70216,Verify that once the data is stored the user is able sync the data back to server using sync button,Not Automated,
70217,To verify that an app  with controls  for multi select Checkboxes and button is rendered successfully on Agent and a local storage DB for the app is created on SQLite DB,Not Automated,
70218,For App created in TC-70217 verify that user is able to enter data and store the same in Local DB on Agent using Submit button on the App form,Not Automated,
70219,To verify that an app  with controls  for Single select  check box  multi select Checkboxes and button is rendered successfully on Agent and a local storage DB for the app is created on SQLite DB,Not Automated,
70220,For App created in TC-70219 verify that user is able to enter data and store the same in Local DB on Agent using Submit button on the App form,Not Automated,
70221,To verify that an app  with controls  for Labels Text boxes Single Select Checkboxes Multi select check box  Camera Control and button is rendered successfully on Agent  and a local storage DB for the app is created on SQLite DB,Not Automated,
70223,For App created in TC-70221 verify that user is able to enter data and store the same in Local DB on Agent using Submit button on the App form,Not Automated,
70225,Tentative| For App created in scenario-8 verify that once the data is stored the user is able sync the data back to server using sync button,Not Automated,
70226,Server | Verify the default sorting of apps on 'Manage app' screen is based on Descending order of 'Created date' i.e. Show Latest Created app first.,Not Automated,
70227,Positive Scenario | Verify that an admin can drag and drop the label control from the Tool box windows to the canvas area.,Not Automated,
70228,Positive Scenario | Verify that an admin can drag and drop the text box control from the Tool box windows to the canvas area and is able to see text box properties on event of drop text box,Not Automated,
70229,Positive Scenario | Verify that the labels attached to the form appears in same order (on the device) it was saved.,Not Automated,
70230,Server | Verify the  button label is  'Update App Info' when App is in Edit Info page .,Not Automated,
70277,Server | Verify that the Success Toast Message is not displayed when user is done with submitting 'Create new app' on the first page .,Not Automated,
70278,Server | Verify that 'Click here to upload icon' is displayed as placeholder for icon browse area while editing info for an existing app.,Not Automated,
70279,Positive Scenario | Verify that the default size of the label is fixed at 14px.,Planned,
70280,Positive Scenario | Verify that the default colour of the label is fixed to #71a6d8.,Not Automated,
70281,Page Validation | Verify the properties appearing on web console when user clicks on any label  dropped on the canvas.,Not Automated,
70282,Create a web-app | Verify that an admin is able to create an app form with default image icon and combination of 1 label; text box; and button.,Not Automated,
70283,Create a web-app | Verify that an admin is able to create a app form with a custom icon image and combination of 1 label; text box; and button.,Not Automated,
70284,Create a web-app | Verify that an admin is able to create a scrollable app form with default image icon and combination of multiple labels; text boxes; and button.,Not Automated,
70285,Create a web-app | Verify that an admin is able to create a app form with a custom icon image and combination of multiple labels; text boxes; and button.,Not Automated,
70286,Export a web-app | Verify that an admin is able to export a app form with a custom icon image and combination of 1 label; text box; and button.,Not Automated,
70287,Export a web-app | Verify that an admin is able to export a app form with default image icon and combination of 1 label; text box; and button.,Not Automated,
70288,Export a web-app | Verify that an admin is able to export a app form with default image icon and combination of multiple labels; text boxes; and button.,Not Automated,
70289,Export a web-app | Verify that an admin is able to export a app form with a custom icon image and combination of multiple labels; text boxes; and button.,Not Automated,
70290,Agent-side validation | Verify that the app with a custom icon image and combination of multiple labels; text boxes; and button renders perfectly on the device agent.,Not Automated,
70291,Agent-side validation | Verify that an app with default image icon and combination of multiple labels; text boxes; and button renders perfectly on the device agent.,Not Automated,
70292,Agent-side validation | Verify that an app with a custom icon image and combination of 1 label; text box; and button renders perfectly on the device agent.,Not Automated,
70293,Agent-side validation | Verify that an app with default image icon and combination of 1 label; text box; and button renders perfectly on the device agent.,Not Automated,
70294,Server | Verify the fevi icons are displayed as per attachment.,Not Automated,
70295,End 2 End | Verify that the textboxes attached to the form appears in same order (on the agent) it was saved.,Not Automated,
70296,Page validation | Verify the properties appearing on web console when user clicks on any text box on the canvas,Not Automated,
70297,Page validation | Verify that an admin is allowed to update the margin between the text of web-form's text box field.,Not Automated,
70298,Page validation | Verify that by clicking on a text box an admin can update the ID of any text box.,Not Automated,
70299,Export a web app | Verify that an admin is able to export a form app with a custom icon image and combination of 1 text box; and button.,Not Automated,
70300,Export a web app | Verify that an admin is able to export a form app with default image icon and combination of 1 text box; and button.,Not Automated,
70301,Publish a web app | Verify that an admin is able to export a form app with default image icon and combination of multiple in scope controls and button.,Not Automated,
70302,Publish a web app | Verify that an admin is able to export a form app with Custom image icon and combination of multiple in scope controls and button.,Not Automated,
70303,Create a web-app | Verify that an admin is able to create a app form with a custom icon image and combination of 1 text box; and button.,Not Automated,
70304,Create a web-app | Verify that an admin is able to create a app form with default image icon and combination of 1 text box; and button.,Not Automated,
70305,Create a web-app | Verify that an admin is able to create a app form with default image icon and combination of multiple text boxes; and button.,Not Automated,
70306,Create a web-app | Verify that an admin is able to create a app form with a custom icon image and combination of multiple text boxes; and button.,Not Automated,
70307,Agent-side validation | Verify that an app with a custom icon image and combination of multiple text boxes; and button renders perfectly on the device agent.,Not Automated,
70308,Agent-side validation | Verify that an app with default image icon and combination of multiple text boxes; and button renders perfectly on the device agent.,Not Automated,
70309,Agent-side validation | Verify that an app with a custom icon image and combination of 1 text box; and button renders perfectly on the device agent.,Not Automated,
70310,Agent-side validation | Verify that an app with default image icon and combination of 1 text box; and button renders perfectly on the device agent.,Not Automated,
70311,Agent | Verify the Default sorting of apps in 'Agent' catalog is displayed in Alphabetical Order.,Not Automated,
70312,Agent | Verify the 'SOTI apps' on agent catalogue page is changed to 'Acme Apps'.,Not Automated,
70313,Agent | Verify the "BACK" and "REFRESH" icons are changed on Android Native App.,Not Automated,
70316,Server | Verify the color of  "CLOSE" icon on App Block Confirmation Pop-Up.,Not Automated,
70317,Server | Verify the Background Color for Alert Popup's Buttons and the Label displayed on them against each confirmation popup.,Not Automated,
70360,Server |  Verify the text on the pop-up's is left aligned,Not Automated,
70391,Server | Verify no apps message is being displayed when user lands on Manage Apps page.,Not Automated,
70392,Page Validation | Verify that admin is able to set any value as default text inside a text box.,Not Automated,
70397,Page Validation| Verify that user is able to set Report Heading property of the text box on IDE,Not Automated,
70398,Page Validation| Verify that user is able to set the text type as text in the property window,Not Automated,
70470,Server | Needs Update | Verify the Message displayed on App Delete Confirmation Pop-Up.,Not Automated,
70471,Server | Verify the text displayed on "App Block Confirmation" pop-up.,Not Automated,
70472,Server | Verify the text message displayed on "App Activate Confirmation" pop-up.,Not Automated,
70473,Server | Verify Empty App Message is displayed for an app in draft state on exporting it.,Not Automated,
70474,Server | Verify the inline validation Error for App Name.,Not Automated,
70475,Server | Verify .(dot) is present in the end of each sentence.,Not Automated,
70507,User Clicks Edit Info for an app from Action Menu,Not Automated,
70509,Positive Scenario | Verify that the label names of a web form app appear in same order (on device agent) as it was designed by the admin.,Not Automated,
70511,Positive Scenario | Verify that when admin updates a NAME of the Label on the property windows same should reflect on the canvas.,Planned,
70513,Verify the validation error displayed on Create App page.,Not Automated,
70514,Verify that placeholder text appears back if user enter the text in text fields & clears it on Edit Info page.,Not Automated,
70515,Verify validation error on Name field in Edit app info form.,Not Automated,
70518,Verify error if png is used other then 192 x 192 on Edit app Info form.,Not Automated,
70519,Verify if png file greater than 600 kb and greater than size 192 x 192 is used than 600KB message is displayed on Edit App Info,Not Automated,
70520,Verify the error if jpg is used on Edit App info form,Not Automated,
70521,Verify that the user is taken to the Manage Apps page when Cancel is clicked on Edit app page,Not Automated,
70522,Verify that for an app  app name can be updated to 20 alphabets.,Not Automated,
70523,Verify that for an app an app name can be updated to alphanumeric values only.,Not Automated,
70524,Verify that for an app app name can be updated to 2 alphabets.,Not Automated,
70525,Verify that for app name can be updated to 2 numeric.,Not Automated,
70526,Verify that for app name can be updated to 2 alpha numeric.,Not Automated,
70527,Verify that app empty description can be updated.,Not Automated,
70528,Verify that for an app description can be updated to 100 characters including numbersalphabets and special characters.,Not Automated,
70529,Verify that image can be uploaded for an app which uses default image as app icon,Not Automated,
70530,Verify that default image can be set for an app which uses user uploaded image as icon app icon.,Not Automated,
70531,Verify that an admin is able to update the font style of any label and same should reflect on canvas and agent.,Not Automated,
70532,Verify that an admin is able to update the font size of any label and same should reflect on canvas and agent.,Not Automated,
70533,Verify that an admin is able to select margin in pixels for any label and same should reflect on canvas and agent.,Not Automated,
70534,Verify that an admin is able to select any colour from the colour picker present in the property window and same should reflect on canvas and agent.,Planned,
70535,Verify that an admin is not able to update the ID of any label.,Not Automated,
70559,Verify HTTP status and response when any of the parameters are empty in json request.,Not Automated,
70560,Verify HTTP status and response when any of the parameters are in invalid format in json request.,Not Automated,
70561,Verify server repsonse when non existent value for parameters are passed in the JSON request,Not Automated,
70562,Verify server response (i.e. '200') when Tennant doesn't have any app installed on the device,Not Automated,
70563,Verify that the service consider only 3 parameters TennantId AppId and version,Not Automated,
70564,Verify server response (i.e. '200')when a new app is present for the tennant,Not Automated,
70565,Verify server response when new app is not present for tennant,Not Automated,
70566,Verify HTTP status 200 and response from server when correct TennantID AppID and Version are sent in request,Not Automated,
70567,For a single app different scenerios would be there on the basis of app status of server & agent,Not Automated,
70568,Verify that service returns HTTP status 200 with filestream if zip file exists on database for the download app service request.,Not Automated,
70569,Verify that service returns HTTP status 404 if zip file is not found for the download app service request,Not Automated,
70570,Verify that the service accepts only 3 parameters TennantId AppId and version,Not Automated,
70571,Verify that HTTP status 400 is returned  when any of the parameter in the request is in wrong format,Not Automated,
70572,Verify that HTTP status 400 is returned  when any of the parameter in the request is empty,Not Automated,
70573,Verify that HTTP status 400 is returned  when any of the parameter in the request is empty,Not Automated,
70574,Verify that HTTP status 400 is returned  when any of the parameter in the request is empty,Not Automated,
70575,Verify service response when nonexistent values for parameters are passed in the reques,Not Automated,
